{
  "certificate_version": "4.2.0",
  "input_digest": "b9a0f6aff913e8cc2a0e162d2c0eebf2cfd9eb228f16affd04fb2cdc3f3a9a8e",
  "claim_id": "SD-VIEW-002",
  "claim_text": "B站教程发布者把短剧推广描述为授权后剪辑片段并发布，为指定应用拉新以赚取佣金。",
  "canonical_claim": "B站教程发布者把短剧推广描述为授权后剪辑片段并发布，为指定应用拉新以赚取佣金。",
  "normalized_ir": {
    "claim_id": "SD-VIEW-002",
    "source_text": "B站教程发布者把短剧推广描述为授权后剪辑片段并发布，为指定应用拉新以赚取佣金。",
    "operator": "OBSERVE",
    "subject": "B站教程发布者",
    "predicate": "把短剧推广描述为",
    "object": "授权后剪辑片段并发布，为指定应用拉新以赚取佣金",
    "polarity": "POSITIVE",
    "quantifier": "UNSPECIFIED",
    "modality": "ASSERTED",
    "scope": {},
    "anchors": {
      "subject": {
        "text": "B站教程发布者",
        "start": 0,
        "end": 7
      },
      "predicate": {
        "text": "把短剧推广描述为",
        "start": 7,
        "end": 15
      },
      "object": {
        "text": "授权后剪辑片段并发布，为指定应用拉新以赚取佣金",
        "start": 15,
        "end": 38
      }
    }
  },
  "protocols_required": [
    "SOURCE_ATTESTATION",
    "SCOPE_BOUNDARY"
  ],
  "machine_checks": {
    "payload": {
      "status": "PASS",
      "errors": []
    },
    "claim_ir": {
      "status": "PASS",
      "errors": []
    },
    "evidence": {
      "status": "PASS",
      "errors": []
    },
    "verified_scope": {
      "status": "PASS",
      "errors": [],
      "plain": {}
    },
    "verified_conditions": {
      "status": "PASS",
      "errors": [],
      "plain": {}
    },
    "verified_exceptions": {
      "status": "PASS",
      "errors": []
    },
    "supported_components": {
      "status": "PASS",
      "errors": []
    },
    "routing": {
      "status": "PASS",
      "errors": []
    }
  },
  "semantic_summary": {
    "status": "PASS",
    "code": "ENTAILMENT_RECORDED",
    "counts": {
      "AMBIGUOUS": 0,
      "CONTRADICTS": 0,
      "ENTAILS": 1,
      "PARTIAL": 0,
      "UNRELATED": 0
    },
    "entailing_evidence_ids": [
      "E-SD-VIEW-002"
    ],
    "contradicting_evidence_ids": [],
    "partial_or_ambiguous_evidence_ids": [],
    "errors": []
  },
  "adversarial_summary": {
    "status": "SKIPPED",
    "code": "ADVERSARIAL_REVIEW_NOT_SUPPLIED",
    "policy": "optional",
    "reviewer_ids": [],
    "reviewed_evidence_ids": [],
    "unreviewed_evidence_ids": [],
    "disagreements": [],
    "falsifiers": [],
    "errors": []
  },
  "locator_authority": {
    "status": "SKIPPED",
    "code": "NO_LOCATOR_SUPPLIED",
    "policy": "optional",
    "by_evidence": {
      "E-SD-VIEW-002": {
        "locator_status": "UNVERIFIABLE",
        "locator_code": "NO_LOCATOR",
        "source_kind": "primary_source",
        "declared_class": "USER",
        "permits": null,
        "rule": null,
        "verdict": "UNVERIFIABLE"
      }
    },
    "violations": [],
    "unverifiable_evidence_ids": [
      "E-SD-VIEW-002"
    ],
    "errors": []
  },
  "snapshot_integrity": {
    "status": "SKIPPED",
    "code": "NO_SNAPSHOT_SUPPLIED",
    "policy": "optional",
    "by_evidence": {},
    "unsnapshotted_evidence_ids": [
      "E-SD-VIEW-002"
    ],
    "errors": []
  },
  "source_authority": {
    "status": "PASS",
    "code": "APPROPRIATE_SOURCE_PRESENT",
    "domain": null,
    "claim_class": null,
    "by_evidence": {
      "E-SD-VIEW-002": "APPROPRIATE"
    },
    "appropriate_evidence_ids": [
      "E-SD-VIEW-002"
    ],
    "insufficient_evidence_ids": [],
    "unclassified_evidence_ids": []
  },
  "protocol_results": {
    "SOURCE_ATTESTATION": {
      "status": "PASS",
      "code": "TRACEABLE_SEMANTIC_SUPPORT",
      "missing": [],
      "details": {
        "evidence_ids": [
          "E-SD-VIEW-002"
        ]
      }
    },
    "SCOPE_BOUNDARY": {
      "status": "PASS",
      "code": "NO_EXPLICIT_CLAIM_SCOPE",
      "missing": []
    }
  },
  "provenance": {
    "status": "PASS",
    "code": "PROVENANCE_ACYCLIC",
    "evidence_count": 1,
    "source_count": 1,
    "independent_root_count": 1,
    "independent_provenance_roots": [
      "BILI-PROMOTION-TUTORIAL"
    ],
    "roots_by_source": {
      "BILI-PROMOTION-TUTORIAL": [
        "BILI-PROMOTION-TUTORIAL"
      ]
    },
    "shared_datasets": {},
    "cycles": [],
    "nodes": {
      "BILI-PROMOTION-TUTORIAL": {
        "derived_from": [],
        "cites": [],
        "dataset_ids": [],
        "evidence_ids": [
          "E-SD-VIEW-002"
        ]
      }
    }
  },
  "evidence_references": [
    {
      "evidence_id": "E-SD-VIEW-002",
      "source_id": "BILI-PROMOTION-TUTORIAL",
      "source_kind": "primary_source",
      "quote": {
        "text": "授权后剪辑片段并发布，为指定APP拉新以赚取佣金",
        "start": 12,
        "end": 36
      },
      "date": null,
      "version": null,
      "scope": {}
    }
  ],
  "transformations": [],
  "supported_components": [],
  "unresolved": [],
  "decisive_reasons": [
    "ALL_GATES_PASSED"
  ],
  "admission": "ADMIT"
}
