{
  "certificate_version": "4.2.0",
  "input_digest": "f338a0e09beb3de50cc69bc347e1bf5be42138395e449a9249b23089810feead",
  "claim_id": "SD-CN-002",
  "claim_text": "《微短剧发展管理办法》规定未取得发行许可证、批准文件或节目编号的微短剧不得播出。",
  "canonical_claim": "《微短剧发展管理办法》规定未取得发行许可证、批准文件或节目编号的微短剧不得播出。",
  "normalized_ir": {
    "claim_id": "SD-CN-002",
    "source_text": "《微短剧发展管理办法》规定未取得发行许可证、批准文件或节目编号的微短剧不得播出。",
    "operator": "FACT",
    "subject": "《微短剧发展管理办法》",
    "predicate": "规定",
    "object": "未取得发行许可证、批准文件或节目编号的微短剧不得播出",
    "polarity": "POSITIVE",
    "quantifier": "UNSPECIFIED",
    "modality": "ASSERTED",
    "scope": {},
    "anchors": {
      "subject": {
        "text": "《微短剧发展管理办法》",
        "start": 0,
        "end": 11
      },
      "predicate": {
        "text": "规定",
        "start": 11,
        "end": 13
      },
      "object": {
        "text": "未取得发行许可证、批准文件或节目编号的微短剧不得播出",
        "start": 13,
        "end": 39
      }
    }
  },
  "protocols_required": [
    "FACTUAL_RECORD",
    "SCOPE_BOUNDARY"
  ],
  "machine_checks": {
    "payload": {
      "status": "PASS",
      "errors": []
    },
    "claim_ir": {
      "status": "PASS",
      "errors": []
    },
    "evidence": {
      "status": "PASS",
      "errors": []
    },
    "verified_scope": {
      "status": "PASS",
      "errors": [],
      "plain": {}
    },
    "verified_conditions": {
      "status": "PASS",
      "errors": [],
      "plain": {}
    },
    "verified_exceptions": {
      "status": "PASS",
      "errors": []
    },
    "supported_components": {
      "status": "PASS",
      "errors": []
    },
    "routing": {
      "status": "PASS",
      "errors": []
    }
  },
  "semantic_summary": {
    "status": "PASS",
    "code": "ENTAILMENT_RECORDED",
    "counts": {
      "AMBIGUOUS": 0,
      "CONTRADICTS": 0,
      "ENTAILS": 1,
      "PARTIAL": 0,
      "UNRELATED": 0
    },
    "entailing_evidence_ids": [
      "E-SD-CN-002"
    ],
    "contradicting_evidence_ids": [],
    "partial_or_ambiguous_evidence_ids": [],
    "errors": []
  },
  "adversarial_summary": {
    "status": "SKIPPED",
    "code": "ADVERSARIAL_REVIEW_NOT_SUPPLIED",
    "policy": "optional",
    "reviewer_ids": [],
    "reviewed_evidence_ids": [],
    "unreviewed_evidence_ids": [],
    "disagreements": [],
    "falsifiers": [],
    "errors": []
  },
  "locator_authority": {
    "status": "SKIPPED",
    "code": "NO_LOCATOR_SUPPLIED",
    "policy": "optional",
    "by_evidence": {
      "E-SD-CN-002": {
        "locator_status": "UNVERIFIABLE",
        "locator_code": "NO_LOCATOR",
        "source_kind": "official_record",
        "declared_class": "OFFICIAL",
        "permits": null,
        "rule": null,
        "verdict": "UNVERIFIABLE"
      }
    },
    "violations": [],
    "unverifiable_evidence_ids": [
      "E-SD-CN-002"
    ],
    "errors": []
  },
  "snapshot_integrity": {
    "status": "SKIPPED",
    "code": "NO_SNAPSHOT_SUPPLIED",
    "policy": "optional",
    "by_evidence": {},
    "unsnapshotted_evidence_ids": [
      "E-SD-CN-002"
    ],
    "errors": []
  },
  "source_authority": {
    "status": "PASS",
    "code": "APPROPRIATE_SOURCE_PRESENT",
    "domain": null,
    "claim_class": null,
    "by_evidence": {
      "E-SD-CN-002": "APPROPRIATE"
    },
    "appropriate_evidence_ids": [
      "E-SD-CN-002"
    ],
    "insufficient_evidence_ids": [],
    "unclassified_evidence_ids": []
  },
  "protocol_results": {
    "FACTUAL_RECORD": {
      "status": "PASS",
      "code": "TRACEABLE_SEMANTIC_SUPPORT",
      "missing": [],
      "details": {
        "evidence_ids": [
          "E-SD-CN-002"
        ]
      }
    },
    "SCOPE_BOUNDARY": {
      "status": "PASS",
      "code": "NO_EXPLICIT_CLAIM_SCOPE",
      "missing": []
    }
  },
  "provenance": {
    "status": "PASS",
    "code": "PROVENANCE_ACYCLIC",
    "evidence_count": 1,
    "source_count": 1,
    "independent_root_count": 1,
    "independent_provenance_roots": [
      "NRTA-MEASURES-2026"
    ],
    "roots_by_source": {
      "NRTA-MEASURES-2026": [
        "NRTA-MEASURES-2026"
      ]
    },
    "shared_datasets": {},
    "cycles": [],
    "nodes": {
      "NRTA-MEASURES-2026": {
        "derived_from": [],
        "cites": [],
        "dataset_ids": [],
        "evidence_ids": [
          "E-SD-CN-002"
        ]
      }
    }
  },
  "evidence_references": [
    {
      "evidence_id": "E-SD-CN-002",
      "source_id": "NRTA-MEASURES-2026",
      "source_kind": "official_record",
      "quote": {
        "text": "未取得发行许可证、批准文件或节目编号的微短剧不得播出",
        "start": 0,
        "end": 26
      },
      "date": null,
      "version": null,
      "scope": {}
    }
  ],
  "transformations": [],
  "supported_components": [],
  "unresolved": [],
  "decisive_reasons": [
    "ALL_GATES_PASSED"
  ],
  "admission": "ADMIT"
}
