{
  "certificate_version": "4.2.0",
  "input_digest": "0115953f0313eb9dc50e2251a9287eba77371c7ba1380449a03d927f7dd3c7cb",
  "claim_id": "SD-DIST-002",
  "claim_text": "DramaBox日本创作者页面所述的基本收益方式是最低保底加收入分成，具体条件以合同为准。",
  "canonical_claim": "DramaBox日本创作者页面所述的基本收益方式是最低保底加收入分成，具体条件以合同为准。",
  "normalized_ir": {
    "claim_id": "SD-DIST-002",
    "source_text": "DramaBox日本创作者页面所述的基本收益方式是最低保底加收入分成，具体条件以合同为准。",
    "operator": "FACT",
    "subject": "DramaBox日本创作者页面所述的基本收益方式",
    "predicate": "是",
    "object": "最低保底加收入分成，具体条件以合同为准",
    "polarity": "POSITIVE",
    "quantifier": "UNSPECIFIED",
    "modality": "ASSERTED",
    "scope": {},
    "anchors": {
      "subject": {
        "text": "DramaBox日本创作者页面所述的基本收益方式",
        "start": 0,
        "end": 24
      },
      "predicate": {
        "text": "是",
        "start": 24,
        "end": 25
      },
      "object": {
        "text": "最低保底加收入分成，具体条件以合同为准",
        "start": 25,
        "end": 44
      }
    }
  },
  "protocols_required": [
    "FACTUAL_RECORD",
    "SCOPE_BOUNDARY"
  ],
  "machine_checks": {
    "payload": {
      "status": "PASS",
      "errors": []
    },
    "claim_ir": {
      "status": "PASS",
      "errors": []
    },
    "evidence": {
      "status": "PASS",
      "errors": []
    },
    "verified_scope": {
      "status": "PASS",
      "errors": [],
      "plain": {}
    },
    "verified_conditions": {
      "status": "PASS",
      "errors": [],
      "plain": {}
    },
    "verified_exceptions": {
      "status": "PASS",
      "errors": []
    },
    "supported_components": {
      "status": "PASS",
      "errors": []
    },
    "routing": {
      "status": "PASS",
      "errors": []
    }
  },
  "semantic_summary": {
    "status": "PASS",
    "code": "ENTAILMENT_RECORDED",
    "counts": {
      "AMBIGUOUS": 0,
      "CONTRADICTS": 0,
      "ENTAILS": 1,
      "PARTIAL": 0,
      "UNRELATED": 0
    },
    "entailing_evidence_ids": [
      "E-SD-DIST-002"
    ],
    "contradicting_evidence_ids": [],
    "partial_or_ambiguous_evidence_ids": [],
    "errors": []
  },
  "adversarial_summary": {
    "status": "SKIPPED",
    "code": "ADVERSARIAL_REVIEW_NOT_SUPPLIED",
    "policy": "optional",
    "reviewer_ids": [],
    "reviewed_evidence_ids": [],
    "unreviewed_evidence_ids": [],
    "disagreements": [],
    "falsifiers": [],
    "errors": []
  },
  "locator_authority": {
    "status": "SKIPPED",
    "code": "NO_LOCATOR_SUPPLIED",
    "policy": "optional",
    "by_evidence": {
      "E-SD-DIST-002": {
        "locator_status": "UNVERIFIABLE",
        "locator_code": "NO_LOCATOR",
        "source_kind": "official_documentation",
        "declared_class": "OFFICIAL",
        "permits": null,
        "rule": null,
        "verdict": "UNVERIFIABLE"
      }
    },
    "violations": [],
    "unverifiable_evidence_ids": [
      "E-SD-DIST-002"
    ],
    "errors": []
  },
  "snapshot_integrity": {
    "status": "SKIPPED",
    "code": "NO_SNAPSHOT_SUPPLIED",
    "policy": "optional",
    "by_evidence": {},
    "unsnapshotted_evidence_ids": [
      "E-SD-DIST-002"
    ],
    "errors": []
  },
  "source_authority": {
    "status": "PASS",
    "code": "APPROPRIATE_SOURCE_PRESENT",
    "domain": null,
    "claim_class": null,
    "by_evidence": {
      "E-SD-DIST-002": "APPROPRIATE"
    },
    "appropriate_evidence_ids": [
      "E-SD-DIST-002"
    ],
    "insufficient_evidence_ids": [],
    "unclassified_evidence_ids": []
  },
  "protocol_results": {
    "FACTUAL_RECORD": {
      "status": "PASS",
      "code": "TRACEABLE_SEMANTIC_SUPPORT",
      "missing": [],
      "details": {
        "evidence_ids": [
          "E-SD-DIST-002"
        ]
      }
    },
    "SCOPE_BOUNDARY": {
      "status": "PASS",
      "code": "NO_EXPLICIT_CLAIM_SCOPE",
      "missing": []
    }
  },
  "provenance": {
    "status": "PASS",
    "code": "PROVENANCE_ACYCLIC",
    "evidence_count": 1,
    "source_count": 1,
    "independent_root_count": 1,
    "independent_provenance_roots": [
      "DRAMABOX-JP-CREATORS"
    ],
    "roots_by_source": {
      "DRAMABOX-JP-CREATORS": [
        "DRAMABOX-JP-CREATORS"
      ]
    },
    "shared_datasets": {},
    "cycles": [],
    "nodes": {
      "DRAMABOX-JP-CREATORS": {
        "derived_from": [],
        "cites": [],
        "dataset_ids": [],
        "evidence_ids": [
          "E-SD-DIST-002"
        ]
      }
    }
  },
  "evidence_references": [
    {
      "evidence_id": "E-SD-DIST-002",
      "source_id": "DRAMABOX-JP-CREATORS",
      "source_kind": "official_documentation",
      "quote": {
        "text": "収益分配は基本的にMG+レベニューシェアで、詳細は契約による",
        "start": 21,
        "end": 51
      },
      "date": null,
      "version": null,
      "scope": {}
    }
  ],
  "transformations": [],
  "supported_components": [],
  "unresolved": [],
  "decisive_reasons": [
    "ALL_GATES_PASSED"
  ],
  "admission": "ADMIT"
}
