{
  "certificate_version": "4.2.0",
  "input_digest": "2c3e529bb4906fe31520c5bfca04227e3cb9a40b3a827f19d2a9557a1a361902",
  "claim_id": "LEARN-004",
  "claim_text": "学习者丙自述自己在三个月内从零基础达到流利。",
  "canonical_claim": "学习者丙自述自己在三个月内从零基础达到流利。",
  "normalized_ir": {
    "claim_id": "LEARN-004",
    "source_text": "学习者丙自述自己在三个月内从零基础达到流利。",
    "operator": "OBSERVE",
    "subject": "学习者丙",
    "predicate": "自述",
    "object": "自己在三个月内从零基础达到流利",
    "polarity": "POSITIVE",
    "quantifier": "UNSPECIFIED",
    "modality": "ASSERTED",
    "scope": {},
    "anchors": {
      "subject": {
        "text": "学习者丙",
        "start": 0,
        "end": 4
      },
      "predicate": {
        "text": "自述",
        "start": 4,
        "end": 6
      },
      "object": {
        "text": "自己在三个月内从零基础达到流利",
        "start": 6,
        "end": 21
      }
    }
  },
  "protocols_required": [
    "SOURCE_ATTESTATION",
    "SCOPE_BOUNDARY"
  ],
  "machine_checks": {
    "payload": {
      "status": "PASS",
      "errors": []
    },
    "claim_ir": {
      "status": "PASS",
      "errors": []
    },
    "evidence": {
      "status": "PASS",
      "errors": []
    },
    "verified_scope": {
      "status": "PASS",
      "errors": [],
      "plain": {}
    },
    "verified_conditions": {
      "status": "PASS",
      "errors": [],
      "plain": {}
    },
    "verified_exceptions": {
      "status": "PASS",
      "errors": []
    },
    "supported_components": {
      "status": "PASS",
      "errors": []
    },
    "routing": {
      "status": "PASS",
      "errors": []
    }
  },
  "semantic_summary": {
    "status": "PASS",
    "code": "ENTAILMENT_RECORDED",
    "counts": {
      "AMBIGUOUS": 0,
      "CONTRADICTS": 0,
      "ENTAILS": 1,
      "PARTIAL": 0,
      "UNRELATED": 0
    },
    "entailing_evidence_ids": [
      "E-VIDEO-3"
    ],
    "contradicting_evidence_ids": [],
    "partial_or_ambiguous_evidence_ids": [],
    "errors": []
  },
  "adversarial_summary": {
    "status": "SKIPPED",
    "code": "ADVERSARIAL_REVIEW_NOT_SUPPLIED",
    "policy": "optional",
    "reviewer_ids": [],
    "reviewed_evidence_ids": [],
    "unreviewed_evidence_ids": [],
    "disagreements": [],
    "falsifiers": [],
    "errors": []
  },
  "locator_authority": {
    "status": "SKIPPED",
    "code": "NO_LOCATOR_SUPPLIED",
    "policy": "optional",
    "by_evidence": {
      "E-VIDEO-3": {
        "locator_status": "UNVERIFIABLE",
        "locator_code": "NO_LOCATOR",
        "source_kind": "primary_source",
        "declared_class": "USER",
        "permits": null,
        "rule": null,
        "verdict": "UNVERIFIABLE"
      }
    },
    "violations": [],
    "unverifiable_evidence_ids": [
      "E-VIDEO-3"
    ],
    "errors": []
  },
  "snapshot_integrity": {
    "status": "SKIPPED",
    "code": "NO_SNAPSHOT_SUPPLIED",
    "policy": "optional",
    "by_evidence": {},
    "unsnapshotted_evidence_ids": [
      "E-VIDEO-3"
    ],
    "errors": []
  },
  "source_authority": {
    "status": "PASS",
    "code": "APPROPRIATE_SOURCE_PRESENT",
    "domain": null,
    "claim_class": null,
    "by_evidence": {
      "E-VIDEO-3": "APPROPRIATE"
    },
    "appropriate_evidence_ids": [
      "E-VIDEO-3"
    ],
    "insufficient_evidence_ids": [],
    "unclassified_evidence_ids": []
  },
  "protocol_results": {
    "SOURCE_ATTESTATION": {
      "status": "PASS",
      "code": "TRACEABLE_SEMANTIC_SUPPORT",
      "missing": [],
      "details": {
        "evidence_ids": [
          "E-VIDEO-3"
        ]
      }
    },
    "SCOPE_BOUNDARY": {
      "status": "PASS",
      "code": "NO_EXPLICIT_CLAIM_SCOPE",
      "missing": []
    }
  },
  "provenance": {
    "status": "PASS",
    "code": "PROVENANCE_ACYCLIC",
    "evidence_count": 1,
    "source_count": 1,
    "independent_root_count": 1,
    "independent_provenance_roots": [
      "VIDEO-C"
    ],
    "roots_by_source": {
      "VIDEO-C": [
        "VIDEO-C"
      ]
    },
    "shared_datasets": {},
    "cycles": [],
    "nodes": {
      "VIDEO-C": {
        "derived_from": [],
        "cites": [],
        "dataset_ids": [],
        "evidence_ids": [
          "E-VIDEO-3"
        ]
      }
    }
  },
  "evidence_references": [
    {
      "evidence_id": "E-VIDEO-3",
      "source_id": "VIDEO-C",
      "source_kind": "primary_source",
      "quote": {
        "text": "学习者丙自述自己在三个月内从零基础达到流利",
        "start": 5,
        "end": 26
      },
      "date": null,
      "version": null,
      "scope": {}
    }
  ],
  "transformations": [],
  "supported_components": [],
  "unresolved": [],
  "decisive_reasons": [
    "ALL_GATES_PASSED"
  ],
  "admission": "ADMIT"
}
